id,part,step,metaphor,style,time,response
cac3e5,A,2,converge,plain,176577,Thrl sales for product B are at the top but eventually drops dramatically at 3rd wave but try to pick up at the middle. Product  A sales drops at second wave to the lowest and picks up at the end with time.
cac3e5,A,3,cross,animate,175989,"Product A the sales are very low at the first wave but picks up dramatically on 3rd wave,meanwhile Product B sales are high at first wave but second wave drops to the middle till the end of time."
cac3e5,A,4,diverge,arrow,145592,"Sales in product B are in the middle but goes up with third wave at the end of time, meanwhile product A sales are at lowest but goes up from wave 2 to the top."
cac3e5,A,5,cross,plain,193445,Product A is at the middle lowest and Product B is at middle highest but both crossflit Product A going higher and Product B lower and they both meet up with same sales at 9th wave.
cac3e5,A,6,diverge,animate,181739,"Sale for Product A are at the lowest at first wave and the sales picks up at the 6th wave and drops at the 9th wave, meanwhile Product B the sales are at the middle  and goes up at the last wave to the end."
cac3e5,A,7,converge,animate,246244,"The sales at product A are in the middle lowest and goes up second wave drops again 4th wave and goes up from 5th wave to end of time, meanwhile Product B the sales are hight but drops to the middle, goes up again and stay in the highest middle till the end of time."
cac3e5,A,8,cross,arrow,173901,"The sales for Product A are very very low but goes up from the 4th wave till the end of time ,meanwhile Product B is in the highest middle dropping and crossing over Product A going down."
cac3e5,A,9,converge,arrow,163943,"The sales for both Product A and B are high and the both make countable profit with time till the end, although Product A makes profit in the middle and Product B is in he highest level. "
cac3e5,A,10,converge,arrow,140813,The sales for Product  A are very low but picks up from third wave to the top with over time. Meanwhile Product  B the sales are very high but drops to the third wave in highest middle but still make a profit.
cac3e5,A,11,converge,plain,175564,"The sales in Product  A start in the middle ,drops at 4th wave and goes up from 5th wave going up with over time ,meanwhile Product  B is in the highest middle and drops a little to the middle  but still stay in the middle till the end of time."
cac3e5,A,12,cross,arrow,182235,"The sales for Product A  are very low but goes up from the third wave crossing over Product B Goin to the top with over time ,meanwhile  Product B the sales are very high but they drop to the middle crossing over Product A to the middle lowest. "
cac3e5,A,13,diverge,plain,162972,"The sales for Product A  are very low not making profit but dramatically goes up and drops to the middle in the last wave ,meanwhile Product B is in the hi6level but drops to the middle but picks at the 7th wave and making profit. "
cac3e5,A,14,cross,animate,138548,Both sales are in the middle Product A is the lowest middle and Product B is in the highest middle they both cross over Product B going lower and Product A going higher.
cac3e5,A,15,converge,animate,210334,"The sales for Product A are in the middle ,goes up from the third wave and drops again and goes up to the to the middle top making profit, meanwhile Product B the sales are high and drops to the middle but still goes higher than Product A."
cac3e5,A,16,diverge,animate,136875,"The sales fro Product A are very low but dramatically goes up but dropping at the last wave to time, meanwhile  Product B the sales are high ,drops to the middle but still goes high again making profit over Product A."
cac3e5,A,17,cross,plain,174124,"Product A is not making any sales in the first wave but dramatically goes up crossing over Product B and makes profit,  meanwhile Product B is in the middle ,goes up from Second wave but sales drops to the middle crossing over from Product A going lower. "
cac3e5,A,18,diverge,arrow,175753,"The sales for Product A are very low but goes up to the highest middle top,meanwhile Product B is in the highest level drops a little to the middle then goes up to the top again making profit more than Product A."
